{
 "format": "spyder-bone/engine_check",
 "format_version": 1,
 "check": "signs",
 "id": "check.signs",
 "version": "3.0.0",
 "engine_min": "1.1",
 "status": "active",
 "title": "Contamination signs: plaster, wax, ester consolidant, burnt",
 "description": "On the standard-resolution stream (high-res transferred first); each sign only when it passes its own B6b gate (check.acquisition, per sign; else that sign is 'gated: noise in <window>'). Kernel: -1e5 x SG17 quadratic 2nd derivative of log10(1/max(R,1e-3)). sharp(c, h, f0, f1) = mean N[c-h..c+h] - 0.5 x (mean N[c-f1..c-f0] + mean N[c+f0..c+f1]). Plaster: joint load = min over the two gypsum bands of (sharp - fauna median) / plaster contrast, fires above the cut; reduced form (only when plaster is gated and check.acquisition lists a fallback): the 1446 nm band's load alone against its own cut. Wax: both sharp tests. Ester: one sharp test. Burnt: the heat check (check.heat). Signs add a FLAG (badge + text) and block an evidence lift (plaster, wax, ester; burnt does not block); they never change the verdict (DECISIONS 53). No clay sign (DECISIONS 41). Soft tier ('possible thin coating', a note only): when no hard contaminant sign fired (plaster, wax, ester, C1) and the scan is eligible (the native standard-resolution scan always, also through a near-uncorrected correction: check.acquisition std_like_within; any other stream when the noise SD of the C1 statistic's SWIR2 term, propagated through its correction, times N2(2000-2100) is at most the eligibility cut), the note fires if any CHECKED sign's statistic reaches its soft line (ester sharp, plaster joint load here; C1 excess in check.c1). It changes no verdict, blocks no lift and is not a flag.",
 "licence": "CC-BY-4.0",
 "created": "2026-10-03",
 "provenance": {
  "basis": "Plaster screen v3 and heat screen v1 frozen on an unreleased archaeological fauna series (statistics only, no site named); wax and ester tests from the SPYDER Bone warnings study (07). Clean pool false alarms: plaster 1, wax 0, ester 0 of 1,201 scans.",
  "soft_tier": "Phase 0c (DECISIONS 74, 76), design A at a 2% clean false-alarm budget: one common quantile of the in-pool clean statistics (C1 excess, ester, plaster load) so the union false-alarm rate in the pool is 2%: C1 6.6 (C1 truncated 6.1, the same offset below its cut), ester 13.1, plaster 0.026. Independent clean sets: about 1.4% pooled; coats at the applied thickness (standard-resolution): PVA 80%, acrylic 95%, cellulose nitrate 36%; protein glue 3-8% (no shippable tier). High-resolution scans noisier than N2(2000-2100) 60 are not eligible (ester noise gives 7.5-25% false alarms); since 3.0.0 (DECISIONS 137) that cut is the C1 SWIR2 term's noise SD through the stream's correction, fixed from v0.2, so it holds for any correction (implied N2 cut: no correction 28, a FieldSpec 3-like correction 16).",
  "reduced_1446": "2026-10-13 (pre-registered; planning hires_fallback): the 1446 nm half of the joint load alone, run only when plaster is gated on the noisy 2000-2100 nm region and the scan is quiet at 1500-1600 nm (check.acquisition fallbacks). Cut = 1.02 x the 99.9th percentile of 1,201 clean scans; 0.2% of 2,322 clean standard-resolution scans (8 sets) exceed it; 9 of 9 real plaster scans do. Validated on high resolution only by adding plaster spectra to real high-resolution scans."
 },
 "parameters": {
  "kernel": {
   "absorbance_clip": 0.001,
   "savgol": {
    "window": 17,
    "polyorder": 2,
    "deriv": 2,
    "delta": 1.0,
    "mode": "interp"
   },
   "scale": -100000.0
  },
  "plaster": {
   "bands": [
    {
     "sharp": [
      1446,
      2,
      8,
      12
     ],
     "fauna_median": -3.471468164711178,
     "plaster_contrast": 136.7924929430862
    },
    {
     "sharp": [
      1945,
      3,
      10,
      15
     ],
     "fauna_median": -2.4107746203449807,
     "plaster_contrast": 165.2875517115569
    }
   ],
   "fires_if_joint_load_above": 0.04859387541885367,
   "reduced_1446": {
    "sharp": [
     1446,
     2,
     8,
     12
    ],
    "fauna_median": -3.471468164711178,
    "plaster_contrast": 136.7924929430862,
    "fires_if_load_above": 0.044254707664456654
   }
  },
  "wax": {
   "all_of": [
    {
     "sharp": [
      1766,
      3,
      9,
      15
     ],
     "at_least": 10.0
    },
    {
     "sharp": [
      1217,
      3,
      9,
      15
     ],
     "at_least": 4.0
    }
   ]
  },
  "ester": {
   "sharp": [
    2254,
    3,
    9,
    15
   ],
   "at_least": 35.0
  },
  "burnt": {
   "check": "heat"
  },
  "gate": "B6b",
  "blocks_lift": [
   "plaster",
   "wax",
   "ester"
  ],
  "flag_only": [
   "burnt"
  ],
  "soft_tier": {
   "ester": {
    "at_least": 13.1
   },
   "plaster": {
    "joint_load_at_least": 0.026
   },
   "c1": "check.c1 soft_tier (full and truncated)",
   "requires_no_hard_sign": [
    "plaster",
    "wax",
    "ester",
    "C1"
   ],
   "eligibility": {
    "native_always": true,
    "otherwise_statistic": {
     "kernel": {
      "absorbance_clip": 1e-06,
      "savgol": {
       "window": 31,
       "polyorder": 3,
       "deriv": 2,
       "delta": 1.0,
       "mode": "interp"
      },
      "scale": -100000.0
     },
     "windows": [
      [
       1726,
       1730,
       1.0
      ],
      [
       1760,
       1764,
       1.0
      ],
      [
       2260,
       2264,
       1.0
      ],
      [
       2348,
       2352,
       1.0
      ],
      [
       1508,
       1512,
       -0.7237030866308519
      ],
      [
       2042,
       2046,
       -0.7237030866308519
      ],
      [
       2173,
       2177,
       -0.7237030866308519
      ]
     ],
     "of": "check.c1: the C1 excess; its SWIR2 term (the detector segment of the N2 window) is read"
    },
    "otherwise_n2_window_nm": [
     2000,
     2100
    ],
    "otherwise_sd_at_most": 0.8722374381043311,
    "correlation_nm": 1.25,
    "anchor": {
     "correction": "transfer.labspec4.hires_to_std@0.2.0",
     "sha256": "c5b9a96824556215fe06318057e58621b78e33c0252032a9097f6ad77a45f687",
     "joins_nm": [
      1000.0,
      1800.0
     ],
     "n2_at_most": 60.0
    }
   },
   "note_key": "possible_thin_coating"
  }
 },
 "golden": {
  "spectra_file": "golden_spectra_checks_v1.json",
  "tolerance": {
   "abs": 1e-09,
   "rel": 1e-09
  },
  "cases": [
   {
    "name": "rc_good_positive_all_six",
    "spectrum_sha256": "ea4c88b7008cb8b19f102f52d39d19a2c4a0b1a93cda1f2e30545ecbdd6f407d",
    "inputs": {
     "gates": {
      "plaster": null,
      "wax": null,
      "ester": null,
      "burnt": null
     }
    },
    "expected": {
     "plaster.status": "assessed",
     "plaster.joint_load": -0.03704496055217154,
     "plaster.fired": false,
     "plaster.gated": false,
     "wax.status": "assessed",
     "wax.sharp.1766": 2.302712485817569,
     "wax.sharp.1217": -1.9591214274462505,
     "wax.fired": false,
     "wax.gated": false,
     "ester.status": "assessed",
     "ester.sharp": 11.745223573688726,
     "ester.fired": false,
     "ester.gated": false,
     "burnt.status": "assessed",
     "burnt.edge50_nm": 493.0,
     "burnt.OH1433": 10.381130207764118,
     "burnt.OH979": 1.6786727438561986,
     "burnt.R_vis": 0.5976829972111554,
     "burnt.charred": false,
     "burnt.calcined": false,
     "burnt.fired": false,
     "burnt.gated": false
    }
   },
   {
    "name": "rc_lift_blocked_ester",
    "spectrum_sha256": "b2fac679cd11be632e8902d04d81b8ea3299630549b89b73e891939d015c1e6d",
    "inputs": {
     "gates": {
      "plaster": null,
      "wax": null,
      "ester": null,
      "burnt": null
     }
    },
    "expected": {
     "plaster.status": "assessed",
     "plaster.joint_load": -0.06961540535694284,
     "plaster.fired": false,
     "plaster.gated": false,
     "wax.status": "assessed",
     "wax.sharp.1766": 1.4680156937097917,
     "wax.sharp.1217": -1.4628157115137466,
     "wax.fired": false,
     "wax.gated": false,
     "ester.status": "assessed",
     "ester.sharp": 44.99999999999775,
     "ester.fired": true,
     "ester.gated": false,
     "burnt.status": "assessed",
     "burnt.edge50_nm": 450.0,
     "burnt.OH1433": 17.864068568988124,
     "burnt.OH979": 2.5735228882227053,
     "burnt.R_vis": 0.5508031430278885,
     "burnt.charred": false,
     "burnt.calcined": false,
     "burnt.fired": false,
     "burnt.gated": false
    }
   },
   {
    "name": "rc_lift_blocked_gated",
    "spectrum_sha256": "653e7e22b860a36605b6605d9c33b4ffb433d00daa49cb1b4e122eaf167fba56",
    "inputs": {
     "gates": {
      "plaster": "noise in 2000-2100 nm",
      "wax": "noise in 2000-2100 nm",
      "ester": "noise in 2000-2100 nm",
      "burnt": "noise in 2000-2100 nm"
     }
    },
    "expected": {
     "plaster.status": "gated: noise in 2000-2100 nm",
     "plaster.fired": null,
     "plaster.gated": true,
     "wax.status": "gated: noise in 2000-2100 nm",
     "wax.fired": null,
     "wax.gated": true,
     "ester.status": "gated: noise in 2000-2100 nm",
     "ester.fired": null,
     "ester.gated": true,
     "burnt.status": "gated: noise in 2000-2100 nm",
     "burnt.fired": null,
     "burnt.gated": true
    }
   },
   {
    "name": "rc_flag_on_good_wax",
    "spectrum_sha256": "c6e4e1c91a8a53d5d9d2893097c55ff13237f33ef87bdf858d3c8526518a145d",
    "inputs": {
     "gates": {
      "plaster": null,
      "wax": null,
      "ester": null,
      "burnt": null
     }
    },
    "expected": {
     "plaster.status": "assessed",
     "plaster.joint_load": -0.03704496055217146,
     "plaster.fired": false,
     "plaster.gated": false,
     "wax.status": "assessed",
     "wax.sharp.1766": 15.999999999999726,